{
  "Title" : "Turbulent channel flow",
  "Field" : {
    "Write weights" : true 
  },
  "Zoltan" : {
    "Partition" : {
      "algorithm" : "hypergraph"
    }
  },
  "Field Slice" : [
    {
      "Verbosity" : 1,
      "Format" : "float",
      "Frequency" : 100,
      "Origin" : [ 0.0, 0.0, 0.0 ],
      "Lattice" : [
         [ 0.25, 0.0, 0.0 ],
         [ 0.0, 0.25, 0.0 ],
         [ 0.0, 0.0, 1.0 ]
      ],
      "Outputs" : [
        { "Default" : 0.0, "Field" : "rE", "File" : "rE" }
      ]
    },
    {
      "Verbosity" : 1,
      "Format" : "float",
      "Frequency" : 100,
      "Origin" : [ 0.0, 0.0, 0.0 ],
      "Lattice" : [
         [ 0.125, 0.0, 0.0 ],
         [ 0.0, 100.0, 0.0 ],
         [ 0.0, 0.0, 0.125 ]
      ],
      "Outputs" : [
        { "Default" : 0.0, "Field" : "ru", "File" : "ru" }
      ]
    }
  ]
}
